{"binding":{"archives":[{"filename":"rickgent-0.1.0-alpha.tgz","inventory_sha256":"b1f8a578d1f0da3a15a91b68ea31d6bfe3fc950813bff9aa40781d421deaf97d","kind":"npm_tarball","sha256":"7f4b11563366c1335507fdd8d26269b7f5f7318c6b7f86c98de6bcbacb0125c0"},{"filename":"rickgent_policies-0.1.0a0-py3-none-any.whl","inventory_sha256":"abeac2ab3ca773840a59c9a5439dc8c3c7e52742a3081f2f0a3e7eb88c543b2a","kind":"python_wheel","sha256":"bcca92b31a0c6d962179d757c571139c41a143ea319ffa11b94fc3d636f977ef"}],"build":{"id":"a91beeb6d4c183f7f63813d41feb66c40e7e9eb4","sha256":"ee698a5743026a488137e4eeee3e4722c696df87124a180c94d1d1e2abcd3f93"},"corpora":[{"id":"orchestrator/test/fixtures/packaging-corpus/manifest.json","sha256":"fa8e1293ef53f30cde8d7e9136684262c0b01018faa48d9cff48cd16f27e10c5"},{"id":"rickgent-policies/test/fixtures/native-policy-corpus/manifest.json","sha256":"f78f42e35ebe045bb4f1c8e9f4b56c0d4ca71c95603b57df24341e676ce42847"},{"id":"orchestrator/test/fixtures/model-identity-corpus/manifest.json","sha256":"b3d0bdc59fa0c9deb26ad08e82845439e9a89539a8f77253d410037a7fae06d2"}],"omnigent_contract_sha256":"d1db539f7c602db8750a7187a3f74fee5ae46386d4f4a05df9c94fba13604b64","release":{"id":"rickgent-trust-spine-release-v1","sha256":"d0a97bd72502ea7af9554efa99be571424ad8be631ecb74dd2b22371c33a44e0"},"source_git_oid":"a91beeb6d4c183f7f63813d41feb66c40e7e9eb4"},"canonicalization":"rickgent-canonical-json-v1","checks":[{"check_id":"archive_identity","evidence_ids":["evidence:archive_identity"],"outcome":"pass","required":true},{"check_id":"installed_containment","evidence_ids":["evidence:installed_containment"],"outcome":"pass","required":true},{"check_id":"source_sentinel_access","evidence_ids":["evidence:source_sentinel_access"],"outcome":"pass","required":true},{"check_id":"checkout_cwd","evidence_ids":["evidence:checkout_cwd"],"outcome":"pass","required":true},{"check_id":"node_path_poison","evidence_ids":["evidence:node_path_poison"],"outcome":"pass","required":true},{"check_id":"pythonpath_poison","evidence_ids":["evidence:pythonpath_poison"],"outcome":"pass","required":true},{"check_id":"source_node_modules","evidence_ids":["evidence:source_node_modules"],"outcome":"pass","required":true},{"check_id":"resource_override","evidence_ids":["evidence:resource_override"],"outcome":"pass","required":true},{"check_id":"editable_direct_url","evidence_ids":["evidence:editable_direct_url"],"outcome":"pass","required":true},{"check_id":"editable_pth","evidence_ids":["evidence:editable_pth"],"outcome":"pass","required":true},{"check_id":"editable_egg_link","evidence_ids":["evidence:editable_egg_link"],"outcome":"pass","required":true},{"check_id":"escaping_symlink","evidence_ids":["evidence:escaping_symlink"],"outcome":"pass","required":true},{"check_id":"missing_resource","evidence_ids":["evidence:missing_resource"],"outcome":"pass","required":true},{"check_id":"implicit_python","evidence_ids":["evidence:implicit_python"],"outcome":"pass","required":true},{"check_id":"wrong_python","evidence_ids":["evidence:wrong_python"],"outcome":"pass","required":true},{"check_id":"native_allow","evidence_ids":["evidence:native_allow"],"outcome":"pass","required":true},{"check_id":"native_deny","evidence_ids":["evidence:native_deny"],"outcome":"pass","required":true},{"check_id":"omnigent_identity","evidence_ids":["evidence:omnigent_identity"],"outcome":"pass","required":true},{"check_id":"sqlite_reopen","evidence_ids":["evidence:sqlite_reopen"],"outcome":"pass","required":true},{"check_id":"git_containment","evidence_ids":["evidence:git_containment"],"outcome":"pass","required":true},{"check_id":"typed_failure","evidence_ids":["evidence:typed_failure"],"outcome":"pass","required":true},{"check_id":"owned_cleanup","evidence_ids":["evidence:owned_cleanup"],"outcome":"pass","required":true},{"check_id":"failure_cleanup","evidence_ids":["evidence:failure_cleanup"],"outcome":"pass","required":true},{"check_id":"unrelated_state_preserved","evidence_ids":["evidence:unrelated_state_preserved"],"outcome":"pass","required":true}],"cleanup":{"failure_path":{"kind":"failure","observed_absent":true,"path":"/private/var/folders/2w/j4nf5k_17ys16yzvmhcx0brh0000gn/T/rickgent-packed-proof-f3rxmO/failed-install/.installing"},"success_path":{"kind":"success","observed_absent":true,"path":"/private/var/folders/2w/j4nf5k_17ys16yzvmhcx0brh0000gn/T/rickgent-packed-proof-f3rxmO/tmp/rickgent-doctor-i3vui4"},"unrelated_state_preserved":true},"containment":{"installed_realpaths":[{"contained":true,"owned_root":"npm_prefix","realpath":"/private/var/folders/2w/j4nf5k_17ys16yzvmhcx0brh0000gn/T/rickgent-packed-proof-f3rxmO/prefix/npm/node_modules/rickgent/dist/cli.js","resource":"cli"},{"contained":true,"owned_root":"npm_prefix","realpath":"/private/var/folders/2w/j4nf5k_17ys16yzvmhcx0brh0000gn/T/rickgent-packed-proof-f3rxmO/prefix/npm/node_modules/rickgent/agents/rickgent/config.yaml","resource":"manager"},{"contained":true,"owned_root":"npm_prefix","realpath":"/private/var/folders/2w/j4nf5k_17ys16yzvmhcx0brh0000gn/T/rickgent-packed-proof-f3rxmO/prefix/npm/node_modules/rickgent/agents/rickgent/agents/worker/config.yaml","resource":"worker"},{"contained":true,"owned_root":"npm_prefix","realpath":"/private/var/folders/2w/j4nf5k_17ys16yzvmhcx0brh0000gn/T/rickgent-packed-proof-f3rxmO/prefix/npm/node_modules/rickgent/proof/metadata.json","resource":"proof_metadata"},{"contained":true,"owned_root":"npm_prefix","realpath":"/private/var/folders/2w/j4nf5k_17ys16yzvmhcx0brh0000gn/T/rickgent-packed-proof-f3rxmO/prefix/npm/node_modules/rickgent/validators","resource":"validators_root"},{"contained":true,"owned_root":"npm_prefix","realpath":"/private/var/folders/2w/j4nf5k_17ys16yzvmhcx0brh0000gn/T/rickgent-packed-proof-f3rxmO/prefix/npm/node_modules/rickgent/LICENSE","resource":"license"},{"contained":true,"owned_root":"npm_prefix","realpath":"/private/var/folders/2w/j4nf5k_17ys16yzvmhcx0brh0000gn/T/rickgent-packed-proof-f3rxmO/prefix/npm/node_modules/rickgent/runtime/resource-map.json","resource":"resource_map"},{"contained":true,"owned_root":"python_venv","realpath":"/private/var/folders/2w/j4nf5k_17ys16yzvmhcx0brh0000gn/T/rickgent-packed-proof-f3rxmO/prefix/python/lib/python3.12/site-packages/rickgent_policies/__init__.py","resource":"rickgent_policies"},{"contained":true,"owned_root":"omnigent_root","realpath":"/private/var/folders/2w/j4nf5k_17ys16yzvmhcx0brh0000gn/T/rickgent-packed-proof-f3rxmO/omnigent-root/omnigent/__init__.py","resource":"omnigent"}],"source_lookup_poisoned":true,"unrelated_cwd":true},"digest":"63b5de57689f592676f7df03feead8e6838674dd287531acfc50c6838f947fbb","digest_algorithm":"sha256_over_utf8_canonical_bytes_excluding_top_level_digest","evidence":{"contains_raw_secrets":false,"items":[{"classification":"live","evidence_id":"evidence:archive_identity","redaction":"public","sha256":"6de269661ab093d0c13dd8e88f477ea6cba2c985356b261efe8795a1bf7e5c25"},{"classification":"live","evidence_id":"evidence:installed_containment","redaction":"public","sha256":"cee99b0ea63d07010c102607d804cebdf166efc28bb006c26db140bdb9fdfc94"},{"classification":"live","evidence_id":"evidence:source_sentinel_access","redaction":"public","sha256":"26b1cb7c331752fc0ee0a6e4e9c70264f8bf8c096584fc611795e0256c824606"},{"classification":"live","evidence_id":"evidence:checkout_cwd","redaction":"public","sha256":"db713b2ad2037e0efc6eec24256cf531d5da6603dfe1391d1e45c24a89cd6b3a"},{"classification":"live","evidence_id":"evidence:node_path_poison","redaction":"public","sha256":"bbb9a98433712d5a46cc7b90f5b90e5020f53e325f082a0b446c3300810c5629"},{"classification":"live","evidence_id":"evidence:pythonpath_poison","redaction":"public","sha256":"09e15c7f63844acdd3d66a477d60a348b4dbae00dbc81acab51a600e7a8a3601"},{"classification":"live","evidence_id":"evidence:source_node_modules","redaction":"public","sha256":"e18130ab4f30b5c43d45948d0e6fa2dff5dbb667db97eef8ecfe3242d17a75ef"},{"classification":"live","evidence_id":"evidence:resource_override","redaction":"public","sha256":"624392438fa57f0bc855c646596e1579ccbe08ff6cdad13eaf39f02c9459f5d2"},{"classification":"live","evidence_id":"evidence:editable_direct_url","redaction":"public","sha256":"0e3b192bdd8931e150c5511fd53cf0d5f094b79cd58cca6efd1428676f394f3d"},{"classification":"live","evidence_id":"evidence:editable_pth","redaction":"public","sha256":"db288312603b4ecee188493d0d08a84bccaf4e6976b0de045e431c7db09c470a"},{"classification":"live","evidence_id":"evidence:editable_egg_link","redaction":"public","sha256":"42b41d89deda68c1c84c6c296637d62dac54f7562b3152205fb67ea5dd30b1a7"},{"classification":"live","evidence_id":"evidence:escaping_symlink","redaction":"public","sha256":"76baf0669ed8a4a0b681aed46f48f66c33db843ae0dddc52f2a8836979d1e97f"},{"classification":"live","evidence_id":"evidence:missing_resource","redaction":"public","sha256":"d1003bf9fd33c81978eafc468110cb147424a6273969a1486d1887ad578bd529"},{"classification":"live","evidence_id":"evidence:implicit_python","redaction":"public","sha256":"52544f1e35c1c092a7c8434f8a14548c74cb543aaea09dfc0e0b1f0aa29ec1d5"},{"classification":"live","evidence_id":"evidence:wrong_python","redaction":"public","sha256":"407412fdcc646927432ba0ad1789c2449a1fa9481bb1fa66d3cfead72e1ef33b"},{"classification":"live","evidence_id":"evidence:native_allow","redaction":"public","sha256":"def9f352a9277229ae3611ab573d1183d2841c89191ed13787fc2dd4e388bca3"},{"classification":"live","evidence_id":"evidence:native_deny","redaction":"public","sha256":"85c674516a9fa6b12ba927905adc7cfe7ffb82da5e0b8660396b7a4ca172d60e"},{"classification":"live","evidence_id":"evidence:omnigent_identity","redaction":"public","sha256":"a9d3c931538f556519f16b06a94bc7725f96a5bc8de5b4415b3b55fc875f067a"},{"classification":"live","evidence_id":"evidence:sqlite_reopen","redaction":"public","sha256":"ad1a72c68c12c470abece405cf8ed82fca80ff71a3490799982776ad914063d8"},{"classification":"live","evidence_id":"evidence:git_containment","redaction":"public","sha256":"059dcee8618a1b0d